{
    "$schema": "http://json-schema.org/schema#",
    "type": "object",
    "properties": {
        "status": {
            "type": "string"
        },
        "policy": {
            "type": "object",
            "properties": {
                "name": {
                    "type": "string"
                },
                "description": {
                    "type": "string"
                }
            },
            "required": [
                "description",
                "name"
            ]
        },
        "findingKey": {
            "type": "string"
        },
        "findingId": {
            "type": "string"
        },
        "cloudGuardAccountId": {
            "type": "string"
        },
        "origin": {
            "type": "string"
        },
        "bundle": {
            "type": "object",
            "properties": {
                "name": {
                    "type": "string"
                },
                "description": {
                    "type": "string"
                },
                "id": {
                    "type": "integer"
                }
            },
            "required": [
                "description",
                "id",
                "name"
            ]
        },
        "reportTime": {
            "type": "string"
        },
        "rule": {
            "type": "object",
            "properties": {
                "name": {
                    "type": "string"
                },
                "ruleId": {
                    "type": "string"
                },
                "description": {
                    "type": "string"
                },
                "remediation": {
                    "type": "string"
                },
                "complianceTags": {
                    "type": "string"
                },
                "logicHash": {
                    "type": "string"
                },
                "severity": {
                    "type": "string"
                }
            },
            "required": [
                "complianceTags",
                "description",
                "logicHash",
                "name",
                "remediation",
                "ruleId",
                "severity"
            ]
        },
        "account": {
            "type": "object",
            "properties": {
                "id": {
                    "type": "string"
                },
                "name": {
                    "type": "string"
                },
                "vendor": {
                    "type": "string"
                },
                "dome9CloudAccountId": {
                    "type": "string"
                },
                "organizationalUnitId": {
                    "type": "string"
                },
                "organizationalUnitPath": {
                    "type": "string"
                }
            },
            "required": [
                "dome9CloudAccountId",
                "id",
                "name",
                "organizationalUnitId",
                "organizationalUnitPath",
                "vendor"
            ]
        },
        "region": {
            "type": "string"
        },
        "entity": {
            "type": "object",
            "properties": {
                "description": {
                    "type": "null"
                },
                "gatewayAddress": {
                    "type": "string"
                },
                "ipCidrRange": {
                    "type": "string"
                },
                "network": {
                    "type": "string"
                },
                "networkData": {
                    "type": "object",
                    "properties": {
                        "autoCreateSubnetworks": {
                            "type": "boolean"
                        },
                        "description": {
                            "type": "string"
                        },
                        "gatewayIPv4": {
                            "type": "null"
                        },
                        "iPv4Range": {
                            "type": "null"
                        },
                        "name": {
                            "type": "string"
                        },
                        "dome9Id": {
                            "type": "string"
                        },
                        "selfLink": {
                            "type": "string"
                        }
                    },
                    "required": [
                        "autoCreateSubnetworks",
                        "description",
                        "dome9Id",
                        "gatewayIPv4",
                        "iPv4Range",
                        "name",
                        "selfLink"
                    ]
                },
                "fingerPrint": {
                    "type": "string"
                },
                "allowSubnetCidrRoutesOverlap": {
                    "type": "boolean"
                },
                "enableFlowLogs": {
                    "type": "null"
                },
                "privateIpGoogleAccess": {
                    "type": "boolean"
                },
                "secondaryIpRanges": {
                    "type": "array"
                },
                "resourceType": {
                    "type": "string"
                },
                "selfLink": {
                    "type": "string"
                },
                "id": {
                    "type": "string"
                },
                "type": {
                    "type": "string"
                },
                "name": {
                    "type": "string"
                },
                "dome9Id": {
                    "type": "string"
                },
                "accountNumber": {
                    "type": "string"
                },
                "assetLabels": {
                    "type": "null"
                },
                "region": {
                    "type": "string"
                },
                "externalFindings": {
                    "type": "null"
                }
            },
            "required": [
                "accountNumber",
                "allowSubnetCidrRoutesOverlap",
                "assetLabels",
                "description",
                "dome9Id",
                "enableFlowLogs",
                "externalFindings",
                "fingerPrint",
                "gatewayAddress",
                "id",
                "ipCidrRange",
                "name",
                "network",
                "networkData",
                "privateIpGoogleAccess",
                "region",
                "resourceType",
                "secondaryIpRanges",
                "selfLink",
                "type"
            ]
        },
        "remediationActions": {
            "type": "array"
        },
        "action": {
            "type": "string"
        },
        "additionalFields": {
            "type": "array"
        }
    },
    "required": [
        "account",
        "action",
        "additionalFields",
        "bundle",
        "cloudGuardAccountId",
        "entity",
        "findingId",
        "findingKey",
        "origin",
        "policy",
        "region",
        "remediationActions",
        "reportTime",
        "rule",
        "status"
    ]
}