{"status":"Failed","policy":{"name":"Webhooks","description":""},"findingKey":"sTiusnmJHuq37FPhDvO0WQ","findingId":"sTiusnmJHuq37FPhDvO0WQ","cloudGuardAccountId":"51722","origin":"Compliance Engine","bundle":{"name":"GCP CloudGuard Best Practices","description":"CloudGuard Best Practices for securing GCP Account","id":-9},"reportTime":"2023-06-09T09:04:54.86Z","rule":{"name":"Ensure Private Google Access is enabled for all subnetworks in VPC Network","ruleId":"D9.GCP.NET.14","description":"Private Google Access enables virtual machine instances on a subnet to reach Google APIs and services using an internal IP address rather than an external IP address. External IP addresses are routable and reachable over the Internet. Internal (private) IP addresses are internal to Google Cloud Platform and are not routable or reachable over the Internet. You can use Private Google Access to allow VMs without Internet access to reach Google APIs, services, and properties that are accessible over HTTP/HTTPS.","remediation":"\n**From Portal**\n1. Go to VPC network GCP Console visiting https://console.cloud.google.com/networking/networks/list\n2. Click the name of the network that contains the subnet.\n3. Click the name of the subnet. The Subnet details page is displayed.\n4. Click on EDIT button\n5. Set Private Google access to On\n6. Click on Save\n\n**From TF**\nSet the private_ip_google_access argument to 'true':\n```\nresource \"google_compute_subnetwork\" \"container_subnetwork\" {\n...\nprivate_ip_google_access = true\n...\n}\n```\n\n**From Command Line**\nRun\n```\ngcloud compute networks subnets update SUBNET_NAME --region=REGION --enable-private-ip-google-access\n```\n\n**References**\n1. https://registry.terraform.io/providers/hashicorp/google/latest/docs/resources/compute_subnetwork\n2. https://cloud.google.com/vpc/docs/configure-private-google-access\n\n","complianceTags":"Network Security","logicHash":"Dxck6J+NBk0PWgpDEvfRLA","severity":"High"},"account":{"id":"serious-conduit-389105","name":"GCP Demo Account NU","vendor":"GCP","dome9CloudAccountId":"ca5ef528-d8dd-41d8-a022-1a820a6adb60","organizationalUnitId":"00000000-0000-0000-0000-000000000000","organizationalUnitPath":""},"region":"northamerica-northeast2","entity":{"description":null,"gatewayAddress":"10.188.0.1","ipCidrRange":"10.188.0.0/20","network":"default","networkData":{"autoCreateSubnetworks":true,"description":"Default network for the project","gatewayIPv4":null,"iPv4Range":null,"name":"default","dome9Id":"8|ca5ef528-d8dd-41d8-a022-1a820a6adb60|Network|default","selfLink":"https://www.googleapis.com/compute/beta/projects/serious-conduit-389105/global/networks/default"},"fingerPrint":"pOH0fyylKJY=","allowSubnetCidrRoutesOverlap":false,"enableFlowLogs":null,"privateIpGoogleAccess":false,"secondaryIpRanges":[],"resourceType":"Local","selfLink":"https://www.googleapis.com/compute/beta/projects/serious-conduit-389105/regions/northamerica-northeast2/subnetworks/default","id":"3838136276665347370","type":"Subnet","name":"default","dome9Id":"8|ca5ef528-d8dd-41d8-a022-1a820a6adb60|Region|northamerica-northeast2|Subnet|default","accountNumber":"serious-conduit-389105","assetLabels":null,"region":"northamerica-northeast2","externalFindings":null},"remediationActions":[],"action":"Detect","additionalFields":[]}